{
  "schemaVersion": 1,
  "tool": {
    "name": "testguard",
    "version": "0.1.0"
  },
  "computedAt": "2026-09-17T02:00:00Z",
  "method": "wilson",
  "confidence": 0.95,
  "bucketBy": "faultClass",
  "source": {
    "kind": "bug-replay",
    "ref": "internal replay corpus, 41 confirmed escapes"
  },
  "buckets": {
    "guard-removed": {
      "n": 41,
      "positives": 32,
      "p": 0.78,
      "ci": [
        0.63,
        0.88
      ]
    },
    "variable-swap": {
      "n": 12,
      "positives": 9,
      "p": 0.75,
      "ci": [
        0.47,
        0.91
      ]
    },
    "literal-changed": {
      "n": 30,
      "positives": 6,
      "p": 0.2,
      "ci": [
        0.1,
        0.37
      ]
    }
  }
}
